[{"rec_id":"2026_04_ARI_NYG:C2","game_id":"2026_04_ARI_NYG","candidate":"C2","side":"home","price_american":100,"p_model":0.526600128174423,"p_mkt_novig":0.478260869565217,"ev":0.0532002563488463,"stake_pct":0,"tier":"lean","pass_reason":"paper only: C2 is unvalidated (nfl_games_v1: not better than market)"},{"rec_id":"2026_04_ATL_NO:C2","game_id":"2026_04_ATL_NO","candidate":"C2","side":"away","price_american":130,"p_model":0.484363741519757,"p_mkt_novig":0.417007358953393,"ev":0.114036605495442,"stake_pct":0,"tier":"lean","pass_reason":"paper only: C2 is unvalidated (nfl_games_v1: not better than market)"},{"rec_id":"2026_04_DAL_HOU:C2","game_id":"2026_04_DAL_HOU","candidate":"C2","side":"none","p_model":0.570518081563916,"p_mkt_novig":0.563492063492063,"stake_pct":0,"tier":"pass","pass_reason":"edge below 3 points"},{"rec_id":"2026_04_DEN_SF:C2","game_id":"2026_04_DEN_SF","candidate":"C2","side":"home","price_american":-155,"p_model":0.741190620930469,"p_mkt_novig":0.582992641046607,"ev":0.219378118304965,"stake_pct":0,"tier":"lean","pass_reason":"paper only: C2 is unvalidated (nfl_games_v1: not better than market)"},{"rec_id":"2026_04_DET_CAR:C2","game_id":"2026_04_DET_CAR","candidate":"C2","side":"home","price_american":154,"p_model":0.437492336261615,"p_mkt_novig":0.377533448138826,"ev":0.111230534104502,"stake_pct":0,"tier":"lean","pass_reason":"paper only: C2 is unvalidated (nfl_games_v1: not better than market)"},{"rec_id":"2026_04_GB_TB:C2","game_id":"2026_04_GB_TB","candidate":"C2","side":"home","price_american":160,"p_model":0.54715922216887,"p_mkt_novig":0.369059656218402,"ev":0.422613977639061,"stake_pct":0,"tier":"lean","pass_reason":"paper only: C2 is unvalidated (nfl_games_v1: not better than market)"},{"rec_id":"2026_04_IND_WAS:C2","game_id":"2026_04_IND_WAS","candidate":"C2","side":"home","price_american":160,"p_model":0.509923858529645,"p_mkt_novig":0.369059656218402,"ev":0.325802032177076,"stake_pct":0,"tier":"lean","pass_reason":"paper only: C2 is unvalidated (nfl_games_v1: not better than market)"},{"rec_id":"2026_04_JAX_CIN:C2","game_id":"2026_04_JAX_CIN","candidate":"C2","side":"away","price_american":124,"p_model":0.556109376731796,"p_mkt_novig":0.427940364439536,"ev":0.245685003879223,"stake_pct":0,"tier":"lean","pass_reason":"paper only: C2 is unvalidated (nfl_games_v1: not better than market)"},{"rec_id":"2026_04_KC_LV:C2","game_id":"2026_04_KC_LV","candidate":"C2","side":"none","p_model":0.352779933114706,"p_mkt_novig":0.336351875808538,"stake_pct":0,"tier":"pass","pass_reason":"edge below 3 points"},{"rec_id":"2026_04_LAC_SEA:C2","game_id":"2026_04_LAC_SEA","candidate":"C2","side":"home","price_american":-355,"p_model":0.802868424243972,"p_mkt_novig":0.747782705099778,"ev":0.0290285437493164,"stake_pct":0,"tier":"lean","pass_reason":"paper only: C2 is unvalidated (nfl_games_v1: not better than market)"},{"rec_id":"2026_04_LA_PHI:C2","game_id":"2026_04_LA_PHI","candidate":"C2","side":"none","p_model":0.382833270509526,"p_mkt_novig":0.406630245840576,"stake_pct":0,"tier":"pass","pass_reason":"edge below 3 points"},{"rec_id":"2026_04_MIA_MIN:C2","game_id":"2026_04_MIA_MIN","candidate":"C2","side":"away","price_american":500,"p_model":0.291129127458789,"p_mkt_novig":0.16,"ev":0.746774764752732,"stake_pct":0,"tier":"lean","pass_reason":"paper only: C2 is unvalidated (nfl_games_v1: not better than market)"},{"rec_id":"2026_04_NE_BUF:C2","game_id":"2026_04_NE_BUF","candidate":"C2","side":"none","p_model":0.720566407797263,"p_mkt_novig":0.70954356846473,"stake_pct":0,"tier":"pass","pass_reason":"edge below 3 points"},{"rec_id":"2026_04_NYJ_CHI:C2","game_id":"2026_04_NYJ_CHI","candidate":"C2","side":"home","price_american":-166,"p_model":0.742633503606551,"p_mkt_novig":0.599638771824202,"ev":0.190003084092425,"stake_pct":0,"tier":"lean","pass_reason":"paper only: C2 is unvalidated (nfl_games_v1: not better than market)"},{"rec_id":"2026_04_PIT_CLE:C2","game_id":"2026_04_PIT_CLE","candidate":"C2","side":"home","price_american":124,"p_model":0.572733437798712,"p_mkt_novig":0.427940364439536,"ev":0.282922900669115,"stake_pct":0,"tier":"lean","pass_reason":"paper only: C2 is unvalidated (nfl_games_v1: not better than market)"},{"rec_id":"2026_04_TEN_BAL:C2","game_id":"2026_04_TEN_BAL","candidate":"C2","side":"none","p_model":0.852818050656248,"p_mkt_novig":0.846501128668172,"stake_pct":0,"tier":"pass","pass_reason":"edge below 3 points"}]
